"",name,website_url,original_language,website_text_in_en,Industrie_Label
1465,WorkGenius,https://www.workgenius.com/en-us/,en,end end freelanc workforc solut workgenius access exclus talent network around globe hundr client trust us talent search join maxim compani potenti workgenius platform connect skill freelanc aroun...,1_recruit_hire_employe_career
1466,MedKitDoc,http://medkitdoc.de/,en,medkitdoc remot treatment without compromis remot medic examin without compromis medkitdoc combin connect medic devic health app certifi video consult provid effect help need care chronic condit d...,0_medic_medicin_health_healthcar
1467,Polarglow Cosmetics,https://polarglowcosmetics.com/,de,polarglow glow calm search menu close shop cart close shop cart shop cart current empti back soon back soon detail follow us contact let keep touch find regular new approach facial care copyright ...,-1_industri_develop_employe_design
1468,Curiosity,https://curiosity.ai/,en,curios copi code find everyth anywher tire search folder email app get curios find everyth place safe comput love folk shortcut everyth alt space start type project kickstart follow minut attende ...,30_tabl_servic_staff_bookingtim
1469,suitApp,https://suitapp.de,de,home comparison platform busi tool suitapp current set indexcurr set follow show result result find right softwar busi tool guarante find look show result result tool relax work life discov excit ...,-1_industri_develop_employe_design
1470,TIVITY,http://www.tivity.one,en,tiviti digit transform platform,25_digit_medicin_healthcar_pagetechn
1471,Isarsoft,https://www.isarsoft.com,en,isarsoft make everi camera count privaci settingswhen visit websit store retriev data browser storag often necessari basic function websit storag use market analyt person site store prefer view in...,14_vr_virtual_design_ai
1472,fridai,https://hellofridai.com/,en,fridai voic assist gamer keep head game menu menu keep head game without interrupt keep head game without interrupt fridai power voic assist made gamer never lag love take screenshot without press...,4_train_perform_platz_play
1473,IFOX Systems,https://www.ifox-systems.de/,de,ifox system process fit tracker industri main menu grow without grow increas product ifox system show industri compani much money spent unnecessarili provid concret inform process optim ifox syste...,-1_industri_develop_employe_design
1474,rockethome,http://www.rockethome.de/,de,rockethom home cosmos creat sketch deutsch telekom diehl meter energi creat sketch ewe lab gearscreat sketch mark e qivicon untitl creat sketch rockethom logo salzburg agcreat sketch stadtwerk bie...,-1_industri_develop_employe_design
1475,Mo's Operations,https://www.develapp.me,de,develapp build brand futurew build brand futur start digit age us focus growthw build brand right strategi mani year experienceabout uswith year experi deliv best result custom servicesin area e c...,-1_industri_develop_employe_design
1476,Recunited,https://recunited.com/,de,visibl corpor cultur recunit,7_advertis_gmbh_brand_openem
1477,Starberry Games,https://www.starberry.games/,en,starberri game genuin good game open menu close menu open menu close menu genuin good game investor break moldw combin familiar gameplay element new idea creat fulfil game experi player merg mayor...,4_train_perform_platz_play
1478,elearnio,https://elearnio.com/,en,digit pre onboard employe develop elearnio solutionssolutionsnewsproductfeaturesnew menu close satisfi motiv employeeselearnio simplifi acceler onboard develop employe preboard onboard train singl...,1_recruit_hire_employe_career
1479,cunio Technologies,http://www.cunio.de,de,cunio let oper real estat effici choos page rent real estat effici oper real estat effici solut let cunio save valuabl time real estat manag residenti real estat benefit increas effici save work h...,6_hotel_holiday_rental_rent
1480,ESG Screen17,http://screen17.com/,en,screen sustain invest chang face sustain invest better futur independ data driven transpar multi vendor approach screen believ sustain consid everi invest strategi innov methodolog combin million ...,-1_industri_develop_employe_design
1481,Foodwater,https://www.foodwater.de/,de,foodwat scald veget cook drink dear custom current econom situat leav us unaffect either unfortun influenc strong decid heavi heart end foodwat project time lion ralf mmel entir ds product team al...,13_meal_dish_lunch_foodji
1482,Mpsi Technologies,https://www.mpsitech.com/,en,generat qualiti sourc code embed softwar whiznium qualiti code project generat lightn speed whizniumsb open sourc servic builder edit develop tool generat fulli featur sourc code tree embed iiot p...,23_industri_translat_technic_technolog
1483,TodaVida,http://www.todavida.de,de,home todavida todavida food life menu food plant forest sale product fund reforest nativ mix forest brazil provid raw materi product enjoy new rainforest creat rainforest tast like everi product r...,16_planter_farm_plant_growment
1484,V-INDUSTRY,https://v-industry.com/,de,imprint v industri imprint v industri gmbh l ernst kirchner stra e ostfildern germani telephon number email info v industri com countri germani vat id de district court stuttgart hrb v industri ac...,7_advertis_gmbh_brand_openem
1485,SenseUp Biotechnology,http://www.senseup.de/,en,senseup biotechnolog j lich develop microbi product strain top pagemoreus tab navig menu item develop microbi product strainswhat dow develop microbi product strain process natur evolut use patent...,0_medic_medicin_health_healthcar
1486,EDITIVE,https://editive.com/,de,enterpris content collabor edit know differ profession version text comparison matter second see chang understand qualiti x better text comparison use revolutionari hd diff algorithm visual focus ...,31_research_readi_ai_develop
1487,Volunteer Vision,https://www.volunteer-vision.com/,en,volunt vision onlin mentor softwar solutionsproductus casesabout usresourcesenchangingth worldon onevolunt vision softwar provid onlin mentor combin customiz e learn content comprehens servic enab...,1_recruit_hire_employe_career
1488,farmerJoe,https://farmerjoe.com/,de,agricultur product app farmerjo login simpl togeth work agcollabor discov use strength team futur agricultur product app farmer busi lab farmer benefitsmak teamwork farm easier product everyon per...,16_planter_farm_plant_growment
1489,KENFORX,http://kenforx.com/,en,kenforx crowd intellig type press enter search let peopl spark use collect knowledg kenforx crowd intellig let peopl spark use collect knowledg kenforx crowd intellig integr peopl employe supplier...,-1_industri_develop_employe_design
1490,Ohlala,https://www.ohlala.com/en/,en,communiti sweet secret ohlala find date model peopl next door start content uniqu look certain someth secret isnt time find place meet ohlala uniqu communiti date photo video tast photo video find...,-1_industri_develop_employe_design
1491,Innovative Payment Systems,https://www.innovative-payment-systems.de/,de,pos system base ipad pos never easier simpl solut save time book deliveri servic correct collect problem ip innov pos system restaur cafe hairdress salon innov payment system simpl solut save time...,-1_industri_develop_employe_design
1492,mySwitch,https://www.stromauskunft.de/tarifaufpasser/,de,tariff watchdog electr gas myswitch monday june v test comparison portal guid commerci electr industri electr commerci electr faq gas chang commerci gas faq gas chang tariff watchdog tariff watchd...,-1_industri_develop_employe_design
1493,Virtrex,http://virtrex.de,de,b b sale custom love virtrex b b sale custom loveb b sale custom loveb b sale custom loveb b sale custom loveb b sale custom loveshorten sale cycl optim sale experi virtrex accompani custom automa...,-1_industri_develop_employe_design
1494,MADixel,https://madixel.de/,de,madixel madixel menu madixel effect track tool support sale madixel tool sale support compani visit websit topic interest visitor inform sale depart find good start first contact compani visit web...,-1_industri_develop_employe_design
1495,pack&satt,https://packundsatt.de/,de,vegan finish product simpli sustain deposit jar packandsatt packandsatt menu close quick lunch wasserfertigleck make sustain nutriti food easi quick enjoy everyday life need hot water spoon minut ...,15_vegan_supplement_meat_dietari
1496,Helios Avionics,https://helios-avionics.com/,en,home helio avion product ad cart horizon improv flight experi give constant control situat awar product sensorbox ahr attitud ad b il horizon portabl glass cockpit reason horizon constant comprehe...,-1_industri_develop_employe_design
1497,innerSense,http://innersense-research.com/,de,innersens research en innersens menu help understand inner sens consum behavior combin depth psycholog digit method develop action orient solut basi alway morpholog depth psycholog take holist loo...,-1_industri_develop_employe_design
1498,mobileJobs,http://www.mobilejob.com,de,home search menu blue collar recruit expert blue collar job market look skill worker knowledg non academ target group happi support target candid recruit employe look employe recruit partner blue ...,1_recruit_hire_employe_career
1499,Asystole,https://www.keinediagnosedurchhemdundhose.de/,de,asystol game us essay price back back back diagnosi scroll shirt pant asystol first interdisciplinari parlor game medic profession known press internet portabl card game doctor term cardsyou dont ...,0_medic_medicin_health_healthcar
1500,Meetingly,http://meetingly.de,de,meet get appoint target averag employe wast almost month year unproduct meet meet guid appoint structur effici sustain manner bet get appoint engag attende multifunct agenda use timer audibl alert...,-1_industri_develop_employe_design
1501,TolaData,https://www.toladata.com/,en,toladata monitor evalu softwar organis menu menu menu simplifi way monitor evalu project digit tool organis creat posit impact trust toladata simplifi project monitor manag track monitor report pr...,9_data_gdpr_industri_research
1502,ScaleHub,http://www.scalehub.com,en,scalehub scalabl autom crowdsourc solut bpos sscs main menu face challeng adapt need scalabl autom crowdsourc solut prescript process process prescript fast x accuraci line privaci regul cost effi...,-1_industri_develop_employe_design
1503,PLAYSPORTS,https://playsports.world/,en,playsport app place player sport playsport live sport way want app everyth need organis event sport field partner train becom part free communiti make world play field get free app april april apr...,4_train_perform_platz_play
1504,GS Bavaria,https://www.gs-bavaria.com/,de,gs bavaria global solut nano materi everi requir,-1_industri_develop_employe_design
1505,Trinkkost,https://trinkkost.de/,de,drink food drink food nutrit minut free ship de worldwid day right return drink food nutrit minutetrinkkost innov natur nutrit shake give bodi essenti vitamin miner nutrient need complet organ mea...,15_vegan_supplement_meat_dietari
1506,D3 Technologies,https://d3-tech.com/,en,home skyroad men let buildroad sky sky mani road urban air vehicl come build road fli air manag system enabl high autom autonom passeng cargo vehicl fli popul urban area safe scalabl effici techno...,-1_industri_develop_employe_design
1507,Volocopter,https://volocopter.com/,en,volocopt bring urban air mobil life inquiri question direct contact get touch us bring urban air mobil life pari air show event info need pari posit first launch citi creat dedic page info need jo...,26_mobil_sms_data_lp
1508,Trusted Cars,https://www.trustedcars.com/,de,car subscript flexibl inclus trustedcar shop close menu account close menu deutsch english deutsch search compar car subscript offer search compar car subscript offer discov attract offer flexibl ...,24_vehicl_car_vehiculum_dealership
1509,geblitzt.de,https://www.geblitzt.de/,de,flash receiv fine hear follow us fine point drive ban check full cost assumpt submit notic fine hear form geblitzt de save time money find regist without oblig submit hear form fine notic quick po...,-1_industri_develop_employe_design
1510,Wikifriend,https://www.wikifriend.net/,en,home wikifriend wikifriend increas popular brandbi generat qualiti lead convers market wikifriend continu develop new semant servic improv communic experi brand user sinc work help creat best cust...,7_advertis_gmbh_brand_openem
1511,LemonAid,https://lemon-aid.de/,de,lemonaid organ lemonad fair trade ingredi home sitemap latest articl newslett sign newslett sign follow us,21_ship_shop_promot_fee
1512,Icon Pro,https://www.iconpro.com/en/home/,en,iconpro ai manufactur lead industri solut let talkar interest offer want discuss general oblig look forward meet partner customersiconpro industri ai solut trust automat intuit actual stakehold pr...,3_manufactur_industri_design_custom
1513,Slected.me,http://slected.de/,de,much could earn compar slect choos page take next career step compar thousand user free increas market valu next career step take next career step compar thousand user free increas market valu nex...,1_recruit_hire_employe_career
1514,Apracor,https://www.apracor.com,de,salesforc full servic partner apracor salesforc consult austria germani take crm next level help ambiti compani success digit sale servic market salesforc partner help compani salesforc implement ...,5_marketplac_retail_salesforc_market
1515,Companize,http://www.companize.com,de,find job realli fit compan fair compani live freeli toggl navig job salari compani fair suit find job compar industri sewag wast manag architectur bank financ construct build materi mine raw mater...,-1_industri_develop_employe_design
1516,neulab+,https://neulabplus.com/,de,neulabplus locat neulab center partner clinic search covid updat due strict hygien regul due covid decid close neulab center intens intern consult furthermor procur raw materi product continu diff...,0_medic_medicin_health_healthcar
1517,Make Opinion,https://www.makeopinion.com/,en,make opinion fast insight real peopl en gb fast insight real peopl design market research expert research experi need survey creation precis audienc target depth analyt platform good price see fir...,-1_industri_develop_employe_design
1518,World of VR,https://worldofvr.net/,de,world vr virtual realiti augment realiti mix realiti cologn vr ar mr xrvirtual augment realiti solut compani turn idea virtual realiti vr ar mr xrvirtual augment realiti solut compani studio idea ...,14_vr_virtual_design_ai
1519,Bragi,http://www.bragi.com/,en,bragi com platform enabl wireless audio product bragi skullcandi afford headphon outperform giant launch high tech audio product compet price point klipsch anc premium brand choos bos gestur contr...,17_music_musicmonst_audio_piano
1520,EverRent,http://www.everrent.de,de,domain name everr de sale enabl javascript pleas enabl javascript reload page everr de domain sale start domain expert onlin leo kobe compani use good domain find new employe via internet everr de...,-1_industri_develop_employe_design
1521,Stelzer Technologies,https://stelzer-technologies.com/,en,home stelzer technolog menu vr ar develop virtual realiti augment realiti stelzer technolog ug haftungsbeschr nkt develop game softwar virtual augment realiti well tool blender uniti help game des...,14_vr_virtual_design_ai
1522,Qdrant Solutions,https://www.qdrant.tech,en,qdrant vector databas make unstructur dataqdr vector databas vector similar search engin deploy api servic provid search nearest high dimension vector qdrant embed neural network encod turn full f...,-1_industri_develop_employe_design
1523,Eppi,https://www.eppi.de/,de,jewel origin jeweleri goldsmith eppi deshop cart item shop cart look forsearchingsearchmor jewelri discountbuy summer jewelri stock discountnew collect littl princefairytal jewelri offici licens l...,2_fashion_shop_custom_brand
1524,Vidatics,https://www.vidatics.de/,en,vidat gmbh contact vidat gmbh businesspark konstanz konstanz germani copyright vidat gmbh,7_advertis_gmbh_brand_openem
1525,SupraTix,https://supratix.com,de,digit ecosystem supratix digit ecosystemsyour holist environ e learn personnel manag suppli chain product tool individu configur product train process make avail everyon quick custom excerptthes o...,-1_industri_develop_employe_design
1526,famPlus,https://www.famplus.de/,de,life profess compet balanc famplus guest main menu guest main menu chang languag de andnbsphotlin guest main menu andnbsphotlin life work compet balanc famplus gmbh base munich hamburg provid info...,-1_industri_develop_employe_design
1527,Baumversand.de,https://www.baumversand.de/,de,baumversand de deliv christma servic help search categori inform telephon support advic mon fri p shop servic inform newslett subscrib newslett receiv best promot voucher subscrib newslett price i...,21_ship_shop_promot_fee
1528,E-Lyte Innovations,http://www.e-lyte-innovations.de,en,electrolyt solut energi storag system highest qaliti e lyte innov mission develop produc perfect electrolyt solut energi storag system part e lyte innov interest becom part innov team locat nster ...,-1_industri_develop_employe_design
1529,Flexopus - Desk Sharing Solution,https://flexopus.com,de,desk share softwar hybrid team flexopus flexopus gmbh en desk share softwar flexibl workplac meet room park space desk share softwar integr seamless compani adapt exact need organ daili work hybri...,-1_industri_develop_employe_design
1530,Goggo Network,http://goggo.network/,en,autonom mobil servic goggo network menu menu menu last mile deliveri power autonom technolog last mile deliveri solut connect busi autonom robot uniqu deliveri solut work custom place order food g...,26_mobil_sms_data_lp
1531,Komuno,http://komuno.de/,de,municip loan municip loan advertis onlin komuno municip financ thought end nathaniel neudeck thoma eitenm ller manag komuno gmbh trend baromet municip financ digit admiss ticket smart citi field s...,18_loan_lender_financ_creditworthi
1532,Pureganic,https://pureganic.de/,de,puregan free ship germani item ad cart check continu shop puregan puregan add cart smoothi jar ml blueseal screw cap piec add cart jam jar ml blueseal screw cap piec get discount purchas sign news...,21_ship_shop_promot_fee
1533,Zwopr,https://zwopr.com/,de,zwopr cultur manag os open menu close menu open menu close menu creat corpor cultur employe love digit cultur manag innov softwar ensur emot employe loyalti retain employe perman zwopr proven cult...,1_recruit_hire_employe_career
1534,Rahn Datenschutz,https://rahn-datenschutz.de/,de,data protect offic rahn data protect extern data protect officerdata protect companywhat data protect meandata protect appli person e g b protect custom supplier employe compani misus person data ...,9_data_gdpr_industri_research
1535,COMODULE,http://comodule.com/,en,comodul open menu close menu open menu close menu empow micromobl connectivityiot solut light electr vehicl empow busi brand gather data insight busi vehicl developmentconnect e bike scooter iot e...,19_bicycl_bike_biketre_buycycl
1536,Finlane,http://finlane.com/,de,finlan gmbh smart crowd solut smart crowd solutionscrowdfinanc crowdfund partner campaignsstart matchfund fund cofund make commit event get talk crowdfinanc softwar solutionsth tyclipso team pione...,-1_industri_develop_employe_design
1537,ecoworks,https://www.ecoworks.tech/,de,ecowork serial refurbish stock skip link toggl navig refurbish stock serial climat neutral fast ecowork plan design instal facad roof element convert apart build netzero standard week plan build p...,-1_industri_develop_employe_design
1538,advocado,https://www.advocado.de/,de,find lawyer onlin advocado help popular area law topic find lawyer area law includedsearch suitabl lawyer popular area law topic find lawyer area law includedsearch suitabl lawyer popular area law...,-1_industri_develop_employe_design
1539,the nu company,https://www.the-nu-company.com/,de,nucao food startup plant tree order shop cart empti subtot checkout holi sh that vegan holi shit that vegan yes read right product vegan sustain packag top damn delici yes read right product vegan...,15_vegan_supplement_meat_dietari
1540,hivr solutions,https://www.hivr.ai/,en,hivr ai process autom hotel venu top pagemoreus tab navig menu item busi lower cost faster autom meet group sale confer hotel focus realli matter customershivr solutionssav time cost distribut aut...,-1_industri_develop_employe_design
1541,Beehive Coworking,https://www.beehive.work/de/,en,beehiv co work space,-1_industri_develop_employe_design
1542,CryptoTec,https://cryptotec.com/,en,home cryptotec blockchain develop consult softwar expertis cover area secur cryptographi blockchain cryptotec offer compani individu softwar concept workshop blockchain develop cryptotecsecur secu...,27_crypto_cryptocurr_cryptotec_bitcoin
1543,Dogsmonaut,https://dogsmonaut.de/,de,dogsmonaut buy sell second hand dog accessori,28_petpatch_pet_vet_veterinarian
1544,Sdui,https://sdui.de/,de,sdui easi communic gdpr compliant app school menu menu digit school daycar simpl secur whether person home sdui gdpr compliant app discov platform turn crisi opportun browser support video tag sol...,11_tutor_classroom_learner_student
1545,Krankenhaus.de,https://www.krankenhaus.de/,de,find right clinic top clinic major citiestop depart comparisontip find clinicfre second opinionget person advic guarante free charg advertis staytop orthopedicsprevent examinationsdiseasestreatmen...,0_medic_medicin_health_healthcar
1546,labfolder,https://www.labfolder.com/,en,electron lab notebook eln labfold toggl menu intellig way record find electron lab notebook inventori manag laboratori protocol trust innov research organ data entri integr data place creat text i...,9_data_gdpr_industri_research
1547,emteria,https://emteria.com:443/,en,ota updat remot manag embed android product solut emteria servic industri applic discov learn custom updat manag android remot digit signag solut point sale system kiosk solut vehicl termin smart ...,-1_industri_develop_employe_design
1548,BionFarming,http://www.bionfarming.com,en,bionfarm unlock power plant,-1_industri_develop_employe_design
1549,LEASINGGURUS,https://leasinggurus.de/,de,leasinggurus configur upload dream car independ leas comparison alreadi offer dont offer leasinggurus de configur compar dream car look leas car privat commerci use could spend hour brows differ l...,24_vehicl_car_vehiculum_dealership
1550,machtfit,http://www.machtfit.de,de,machtfit health platform healthi success togeth hr topic blog categori menu healthi success togeth machtfit platform final reach employe health manag motiv employe make compani success modern heal...,0_medic_medicin_health_healthcar
1551,Formigas,http://www.formigas.de,de,formiga studio digit innovationco creat futur tech driven innov konstanz germanyw formigasa design innov develop partner help take control futur e mobilitytogeth mahl make e mobil sustain spin cha...,-1_industri_develop_employe_design
1552,Blue Yonder,https://blueyonder.com/,en,blue yonder world lead suppli chain manag solut toggl navig retail groceri today consum driven world buy habit shift quick retail especi grocer empow afford fresh conveni deliveri option critic me...,-1_industri_develop_employe_design
1553,Lionizers,https://lionizers.com/,de,softwar futur menu softwar futur lionize develop custom softwar solut tailor specif busi need medium size compani softwar agenc partner digit transform support optim busi process achiev real compe...,23_industri_translat_technic_technolog
1554,idento.one,http://idento.one/,de,idento person data bank previous next deinidento next generat ssi self sovereign ident idm ident manag world realli know deal digit twin idento regain control data collect data compani store place...,-1_industri_develop_employe_design
1555,ontrabo,https://ontrabo.de/,de,ontrabo book manag account choos page book manag account end end solut europ whether flight rental car taxi train hotel extens seminar group event trip book travel step portal click freeli combin ...,-1_industri_develop_employe_design
1556,Nantis,https://nantis.de/,de,home nanti gmbh electron develop stuttgart,-1_industri_develop_employe_design
1557,quirion,https://www.quirion.de/,de,invest money testsieg best digit invest quirion de investmentw invest youyou invest yourselfservic packagesact quirionacademyth right invest agequirion live download app nowopen account minutesinv...,8_invest_etf_portfolio_investor
1558,Wryte,http://wryte.io/,de,home smart write ipad wryte top pagemoreus tab navig menu item enhanc school success wrytebett educ effici manag schoolsexperi wryte free schoolwryt offer control benefitstak control school ecosys...,11_tutor_classroom_learner_student
1559,Texlock,https://www.tex-lock.com/,de,bicycl lock made textil flexibl secur beauti tex lock bicycl lock e bike lock motorcycl lock mope lock scooter lock e scooter lock e bike lock tex lock bicycl lock flexibl secur beauti textil rope...,19_bicycl_bike_biketre_buycycl
1560,corners & edges,https://www.corners-and-edges.de/,de,corner edg search categori ship method payment servic hotlin question call us mon fri p shop servic inform newslett subscrib free newslett dont miss design excit promot took note price incl valu a...,21_ship_shop_promot_fee
1561,webvalid,http://webvalid.de/,de,webvalid de detail compani data million compani profil sector million decis maker name function million structur annual financi statement detail date compani data b b address busi inform webvalid ...,-1_industri_develop_employe_design
1562,adjoe,https://adjoe.io,en,advertis technolog outperform adjo monet resourc monet resourc advertis technolog outperform adjo develop cut edg technolog allow publish advertis take app busi next level platform scale mobil bus...,-1_industri_develop_employe_design
