"",name,website_url,original_language,website_text_in_en,Industrie_Label
2147,meintierbestatter.de,https://meintierbestatter.de/,de,undertak cart empti subtot go cart undertak trust care empathet trust us lose belov pet never easi mean say goodby famili member know pain want make possibl mourn anim difficult time leav everyth ...,-1_industri_develop_employe_design
2148,Rententipps.de,https://www.rententipps.de,de,welcom pension tip inform portal social old age provis welcom welcom inform portal social old age provis find everyth need know pension old age provis type pension statutori privat help find way a...,-1_industri_develop_employe_design
2149,tele-LOOK,https://www.tele-look.com/,de,visual support softwar save time cost make appoint live video support servic solut shortag skill workersprocess servic case staffassist realiti cloud softwareremot supportvisu support softwaresav ...,3_manufactur_industri_design_custom
2150,NUI COSMETICS,https://nuicosmetics.com/,de,nui cosmet natur vegan glutenfre beauti product berlin back free ship satisfi custom payment klarna paypal next complexion eye lip set navig make complexion eye lip care face care facial cleans bo...,22_skincar_retail_shop_soap
2151,Instruments of Things,https://instrumentsofthings.com/,en,instrument thing menu search somi sound subscrib save join communiti receiv latest product news live perform stori discount code order subscrib becom instrument make movement audibl becom music so...,17_music_musicmonst_audio_piano
2152,Mambu,https://www.mambu.com/,en,saa cloud bank platform mambuit look like javascript disabl part site work expect enabl javascript full experienceopen menuback topjoin trailblaz chang bank best financi brand world power mambus c...,-1_industri_develop_employe_design
2153,y42,https://www.y42.com/,en,mission control data pipelinesproductspipelin automationcollaborationgovernancesolutionsbi departmentbi industryresourcescompanymiss control data pipelinesmodern dataop cloudraw datamodern dataop ...,-1_industri_develop_employe_design
2154,Betriebsmittelhelden,https://www.betriebsmittelhelden.de/,de,platform agricultur input z specialist purchas input understand dairi farm dairi farm way life anim passion order maintain health status anim best possibl way high qualiti feed crucial offer best ...,16_planter_farm_plant_growment
2155,Kinderheldin,https://kinderheldin.de/,de,pregnanc babi time onlin cours kinderheldin loginkinderheldin companion pregnanc babi timeus onlin cours shape everyday famili life need safe flexibl easyyour path becom kinderheldin get access un...,-1_industri_develop_employe_design
2156,kartenmacherei,https://www.kartenmacherei.de/,de,make card print photo card greet card onlin kartenmacherei menu kartenmacherei rate birth show pregnanc card ship extra poster birth door sign wed wed invit registri offic chang date card said yes...,2_fashion_shop_custom_brand
2157,Innok Robotics,http://innok-robotics.de/,de,innok robot autonom mobil outdoor robot menu news product us news product us autonom mobil robot market leader indoor outdoor softwar vehicl hardwar latest sensor perfect integr reliabl mobil robo...,3_manufactur_industri_design_custom
2158,Deutsche Autohaus,https://www.deutscheautohausag.de,de,daag deutsch autohaus ag,7_advertis_gmbh_brand_openem
2159,ARTFLAKES,https://www.artflakes.com/,en,buy poster art print canva print artflak sell art design photographi artflak com afghanistan albania algeria american samoa andorra angola anguilla antigua barbuda argentina armenia aruba australi...,-1_industri_develop_employe_design
2160,SenseING GmbH,https://www.senseing.de,de,sens gmbh iot total solut dynam versatil team work project great enthusiasm open clear communic eye level alway come first vacanc what new sensor data complet iiot solut data base process optim ii...,-1_industri_develop_employe_design
2161,Troodle Mobility Solution,http://www.troodle.me,de,troodl ride togeth mobil freedom flexibl safe sustain cheap fon kontakt troodl toggl navig troodl first ridesurf system troodl revit mobil cultur hitchhik mobil app offer driver spontan safe optio...,-1_industri_develop_employe_design
2162,MeinPraktikum,https://www.meinpraktikum.de/,de,meinpraktikum de find internship student job longer support internet explor recommend switch new browser e g b place find guid entrepreneurship start find internship student jobwa look jobsjob com...,1_recruit_hire_employe_career
2163,3dTrust,http://3dtrust.de,en,dtrust addit manufactur workflow softwar,-1_industri_develop_employe_design
2164,German Bionic,https://www.germanbionic.com/,en,german bionic smart wearabl tool workplac safeti german bionic en english english wearabl tool revolution workplac safeti creat sustain futur workforc smart wearabl tech enabl happi healthi sustai...,0_medic_medicin_health_healthcar
2165,Dracoon,https://www.dracoon.com/de/home,de,dracoon high secur file exchang platform compani search search toggl menu search search toggl menu secur compliant simpl certifi file exchang ad valu store share manag file secur gdpr compliant ti...,-1_industri_develop_employe_design
2166,vacaVista,https://www.vacavista.com/,de,vacavista search vacat rental worldwid world vacat rentalsov vacat home apart search book direct onlin copyright vacavista right reserv favorit sell holiday real estat buy holiday real estat perso...,6_hotel_holiday_rental_rent
2167,SIMUTENCE,http://www.simutence.de,en,simut digit composit solut search site enabl smart engin composit simut high special independ partner virtual design manufactur process compon plastic fiber reinforc composit hybrid whether oem co...,3_manufactur_industri_design_custom
2168,Caterna,https://www.caterna.de,de,home caterna vision content goe home new digit amblyopia therapi caterna occlus effect combin therapi children function visual impair call amblyopia easi hometh caterna therapi carri easili home l...,0_medic_medicin_health_healthcar
2169,r3charge,https://www.r3charge.com/,en,r charg book hotel ev charg station worldwid account set travel r charg room adult children children age age age age room adult children children age age age age room adult children children age a...,6_hotel_holiday_rental_rent
2170,Polyteia,http://www.polyteia.de,de,polyteia data platform public sector polyteia launch day data platform public sector polyteia public administr automat combin data specialist procedur regist creat report push button use public ad...,10_cloudplan_cloud_kubernet_servic
2171,NewStore,https://www.newstore.com/,en,omnichannel store solut enterpris retail newstor x bring joy back retail newstor mobil pos integr cloud order manag retail like untuckit decathlon use platform store associ app deliv end end omnic...,-1_industri_develop_employe_design
2172,Fabula Games,http://www.fabula-games.de,de,home serious game gamif fabula game toggl navig use onlin game inform secur home offic serious game unbeat effect everi compani need employe develop solut fabula game ensur train fun effect sustai...,4_train_perform_platz_play
2173,catkin,http://www.catkin.eu,de,digit logist catkin,25_digit_medicin_healthcar_pagetechn
2174,AppYourself,https://appyourself.net/,de,build app app builder readi made modul io android creat appyourself menu app app maker creat readi made modul io android app self servic reach target group creat busi app intuit app builder withou...,3_manufactur_industri_design_custom
2175,SCATCH,https://scatch.io,de,scatch shop app product check mobil shoppingmobileshoppingbrand shop compar price product check scan buymark shop compar price product check scan buy mproduct mreview k kbrandsshopshopbrandsshopdi...,-1_industri_develop_employe_design
2176,Easy2Parts,http://www.easy2parts.com,de,system supplier product part product method us product method us person system supplier product part search purchas platform product part assembl end contact compon product method supplier network...,-1_industri_develop_employe_design
2177,KELLNEROO,https://www.kellneroo.app,de,home kellneroo gastro person gastro job menu menu kellneroo new innov fast gastro job platform pocket kellneroo new innov fast gastro job platform pocket,-1_industri_develop_employe_design
2178,Therapio,http://www.therap.io,de,therap io therap io app therap io app motiv patient exercis home regular accord instruct person train physiotherapi ergotherapi logopaedia alway smartphon app make communic therapist patient easi ...,0_medic_medicin_health_healthcar
2179,FLAXRES,https://www.flaxres.com/,de,flaxr sustain futur clever technolog de deutsch english de deutsch english technolog improv world sustain photovolta recycl rethought technolog compani flaxr set task revolution recycl composit ma...,12_photovolta_solar_pv_industri
2180,Swaarm,http://swaarm.com/,en,swaarm award win perform market platform watch free masterclass webinar privaci menu scale perform market swaarm premium track platform made afford use swaarm simplifi autom optim market effort wa...,5_marketplac_retail_salesforc_market
2181,Icinga,https://icinga.com/,en,icinga monitor entir infrastructur icinga monitor oper access custom stori select page monitor entir infrastructur find answer take action becom problem solver flexibl take way stay curious stay p...,-1_industri_develop_employe_design
2182,Tier Mobility,http://www.tier.app/de,de,tier chang mobil good animalsarabiccatalancroatiandanishdutchenglishfinnishfrenchgermangreekhebrewhungarianitaliannorwegianpolishportugueseromanianslovakspanishswedishcompanyproductsresourcessuppo...,26_mobil_sms_data_lp
2183,Mergeflow,https://www.mergeflow.com/,en,mergeflow ai research assist deep tech innov menu ai research assist deep tech innov free day credit card requir mergeflow trust deep tech innov profession technolog intens industri use mergeflow ...,9_data_gdpr_industri_research
2184,Pendix,http://www.pendix.de/,de,pendix ebik convers kit bicycl type retrofit bike ebik pendix edriv drive fun overcom weaker self tailwind pendix begin year mani peopl feel well known spring tired addit inner weaker self particu...,19_bicycl_bike_biketre_buycycl
2185,SurveyCircle,https://www.surveycircle.com,en,surveycircl find survey particip support research sign free log email password find survey participantsand support research largest communiti onlin research look survey particip bachelor master do...,-1_industri_develop_employe_design
2186,Casble // Dojo Technologies,https://casble.com,de,casbl share sell knowledg know learn lunch webinar design e learn success octob nd noon sign advisor train provid meet learner need help streamlin live train creat new list minut inspir learner cu...,-1_industri_develop_employe_design
2187,ENVISIBLE,https://www.envisible.de,de,home invis mani aspect everyday life impercept natur sens invis forc stress process affect bodi mechan effect structur behavior devic sport medicin invis nake eye reveal latest technolog discov te...,0_medic_medicin_health_healthcar
2188,Personio Operations,https://www.personio.de,de,personio peopl oper system defeaturesextra efficiencyget know personio mini personio right hr softwar find demo webinarhuman resourcestal managementpayrollextra efficiencyabout ushr knowledgedisco...,1_recruit_hire_employe_career
2189,Saloodo,https://www.saloodo.com,en,saloodo digit freight platform menu menu make logist fast smart reliabl saloodo connect shipper carrier digit freight platform featur digit freight platform saloodo onlin freight exchang digit fre...,20_freight_freightfind_transport_cargo
2190,MyCabin,https://mycabin.eu/,de,tent pitch pitch natur mycabininfosfaqsth dictionari frequent ask question travel hostspressw put import inform mycabin interview fact press releas breathtak photosblogread excit tour beauti regio...,6_hotel_holiday_rental_rent
2191,Cognotekt,http://cognotekt.com/,de,cognotect clariti nois menu clariti nois understand life scienc data analyt uniqu perspect give secur make complex decis analyz opportun risk product evalu portfolio improv process data level chal...,0_medic_medicin_health_healthcar
2192,Greentastic,https://www.greentastic.de/,en,greentast concept store paus slide show play slide show deliveri time work day deliveri time work day free ship free ship currenc germani eur greentast site navig close search close cancel subtot ...,22_skincar_retail_shop_soap
2193,3MEGAWATT,http://www.3megawatt.com,en,home power factor best class solut entir asset lifecycl wind solar storag hydro acceler clean energi transit aw empow peopl power world power aw trust data high valu outcom reduc cost complex powe...,12_photovolta_solar_pv_industri
2194,Geruchskontrolle,https://www.geruchskontrolle.de/,de,odor neutral odor elimin odor control de order hotlin ship dhlfree ship de schneider profichemi gmbh co kg log shop basketther item shop basket odor neutral odor elimin new product new rang odorco...,-1_industri_develop_employe_design
2195,SEMPRIA,https://sempria.de,de,sempria search engin languag technolog cognit site search homesempria search cognit search engin find complet precis conveni automat understand languag specialist terminolog ever grow amount text ...,31_research_readi_ai_develop
2196,Kisura CS,https://www.kisura.de/,de,home kisura onlin stylist turn give discount use period june june th use follow voucher code birthday euro minimum purchas valu cannot combin subscript discount promot non cashabl give discount us...,2_fashion_shop_custom_brand
2197,WeAdvise,https://www.weadvise.de,en,weadvis digit wealth manag solut digit wealth manag easi integr solut digit hybrid busi model high adapt need busi independ bank asset manag immedi readi use regulatori complianc combin maximum le...,8_invest_etf_portfolio_investor
2198,earthTV,https://www.earthtv.com/en,en,inspir world live webcam program earthtv var etvgtmid gtm pl wv z inspir world new program america live new program world live standard english new program world live standard german new program w...,-1_industri_develop_employe_design
2199,Seven Senders,https://www.sevensenders.com/,en,optim intern deliveri sender connect central api gain access deliveri platform enhanc ship portfolio addit servic use search engin inform shipment communic interact recipi keep custom date track p...,20_freight_freightfind_transport_cargo
2200,LadyBWell - THE BREAST HEALTH PEOPLE,http://www.LadyBWell.com,en,ladybwel breast health peopl close select page custom breast cancer prevent program b b breast cancer kill ladi everi minut india increas younger age new case india surviv less year never breast e...,0_medic_medicin_health_healthcar
2201,Goodlife Company,http://goodlife-company.de/,de,goodlif compani scroll welcom goodlif good food good vibe goodlif healthi lifestyl that fun easi achiev exact made mission want bring movement food market healthi snack product think unhealthi sna...,-1_industri_develop_employe_design
2202,Edkimo,https://edkimo.com/,en,feedback learn edkimo give feedback start edkimo feedback learn feedback power influenc learn achiev edkimo ask question receiv valuabl feedback student particip real time teacher trainer see lear...,11_tutor_classroom_learner_student
2203,Kolonne Null,http://www.kolonnenull.com,de,column non alcohol wine est berlin forg alcf free premium wine new vintag new vintag new vintag new vintag new vintag new vintag new vintag new vintag new vintag new vintag new vintag new vintag n...,29_wine_wineri_winemak_grapealli
2204,VetStage,https://www.vetstage.de/,de,vetstag job vet tfa internship regist work anim health industri vet vet tfa tpa tfa tpa student student read accept creat profil continu login visibl visibl stay log log continu help anim help exc...,0_medic_medicin_health_healthcar
2205,Pupil Labs,https://pupil-labs.com/,en,eye track technolog gain insight human behavior pupil lab ad cartview cartmenushop cartey track research beyondneon newest eye tracker eye track hardwar need small modul deep learn power readi nex...,-1_industri_develop_employe_design
2206,fox e-mobility,http://fox-em.com/,en,fox em fox e mobil ag manufactur new mia sustain solut electr vehicl pleas clickpleas click media februari februari februari februari februari januari januari januari januari design updat fox deta...,-1_industri_develop_employe_design
2207,Polsterando,https://www.polsterando.de,de,profession upholsteri clean carpet clean polsterandoyou use outdat browser improv secur servic profession upholsteri carpet cleaningno travel costsdirect homewith fix price guaranteement worksimpl...,-1_industri_develop_employe_design
2208,mealmates,https://www.mealmates.de/,de,mealmat canteen everyon without order lunch menu canteen everyon without lunch deliv offic order delici lunch dish deliv workplac mealmat differ worth tri delici daili chang select high qualiti di...,13_meal_dish_lunch_foodji
2209,ATC ALUVATION,https://aluvation.com/,en,home atc aluv technolog center paderborn gmbh https aluv com contao main phpdo themesandt tl layoutandid andrt ef e b dbae da b fdb fandref dac heat treatment aluv technolog center paderborn atc c...,-1_industri_develop_employe_design
2210,Aufzughelden,http://aufzughelden.com/,de,elev hero product digit spine gmbh product elev manag elev hero box increas avail elev system save cost would like learn work case case special handelsblatt smart build fact center piec elev hero ...,-1_industri_develop_employe_design
2211,Tickaroo,http://www.tickaroo.com,en,live digit publish platform liveblog softwar support tickaroo product want revolution share live news cut edg digit report softwar put focus live storytel journalist live report reli germani marke...,-1_industri_develop_employe_design
2212,FLUTLICHT,http://www.flutlicht-film.de,de,floodlight film ohg toggl navig floodlight film ohg,14_vr_virtual_design_ai
2213,Alasco,https://www.alasco.de/,de,financi control esg manag softwar alaska,-1_industri_develop_employe_design
2214,blackshield.security,https://www.blackshield-security.de,de,blackshield secur secur state process want support process first step activ secur speak pen test evalu vulner scan plan proceed social engin implement phish simul awar train employe philosophi bla...,-1_industri_develop_employe_design
2215,Aporize,https://aporize.com/,de,apor medic intak simplifi menu digit medic assist support take medic apor daili companion take multipl medic creat medic plan free alway avail onlin check medic interact remind take time easili or...,0_medic_medicin_health_healthcar
2216,METHODIGY,https://www.methodigy.de/,de,methodigi structur tool lawyer main menu methodigi structur tool lawyersmethodigi first softwar explicit special legal file structur knowledg work new intuit use immedi usabl provid answer challen...,-1_industri_develop_employe_design
2217,Horizn Studios,http://horizn-studios.com,en,smart luggag premium travel accessori horizn studioslet go open new horizon blaze trail make lifelong memori creat genuin connect join communiti next generat travel smart luggag backpack accessori...,-1_industri_develop_employe_design
2218,repeatmobile,https://www.repeatmobile.com/en/,en,repeatmobil chang need repetit menu toggl menu toggl main menu menu toggl menu toggl traine dont achiev goal help chang repeatmobil app seminar particip use smartphon review learn content retain f...,-1_industri_develop_employe_design
2219,ESGendium,https://www.esgendium.com/,de,esgendium lean sustain softwar hello world lean sustain softwar small medium size companiesfor compani want becom sustain dont know start step first sustain report enter compani dataher enter gene...,-1_industri_develop_employe_design
2220,Echometer,http://echometerapp.com/,en,team health perform tool echomet men men develop healthi self organ team even without scrum master echomet psycholog base tool continu improv retrospect help team reach full potenti even without s...,4_train_perform_platz_play
2221,BANKSapi,https://banksapi.de/,en,bank api bank daten aggreg und datenanalys banksapi smart open bank build bank product without bafin licens api analyt platform turn account inform insight lead base custom financi dna embed finan...,8_invest_etf_portfolio_investor
2222,Digital Buildings,http://www.enbead.com,en,bead technolog engag build europ hohenzollerndamm berlin germani hq campus dr san mateo ca full analysi human behavior occup trend build commerci privat lot personnel need mean increas oper cost t...,-1_industri_develop_employe_design
2223,Elucidate,http://www.elucidate.co,en,elucid data driven risk manag product solut resourc compani turn risk manag driver busi growthsanct regul made busi growth increas complex elucid enabl front back offic team work togeth smooth mak...,-1_industri_develop_employe_design
2224,CALIMA Safety,https://www.calima.io/,de,calima emerg system lone worker emerg system lone workersprotect employe calima order abl react best possibl event oper emerg emerg app smartphon pna implement quick easili allow effici improv occ...,3_manufactur_industri_design_custom
2225,Drakensberg,https://www.drakensberg.de/,de,drakensberg travel bag weekend made leather canva newslett discount free climat neutral ship germani dhl free return ship germani servic telephon languag deliveri countri travel bag adventur life ...,2_fashion_shop_custom_brand
2226,DL Remote,https://www.dl-remote.com/,en,dl remot x recruit perform interest learn thank email touch asap pleas check inbox trust team like activ search slight differ precis target combin talentpool relev talent channel find address best...,1_recruit_hire_employe_career
2227,Rysta,http://www.rysta.io,de,rysta smart room climat sensor kindergarten school univers product solutionsrysta protect room climat build monitor rysta protect room climat build monitoringth smart room climat sensor kindergart...,-1_industri_develop_employe_design
2228,Xentara (by embedded ocean),https://www.xentara.io/,en,home xentara home get fast track smart manufactur decad peopl talk next industri revolut industri leader feel like happen industri internet thing iot still proof concept phase data often trap isol...,23_industri_translat_technic_technolog
2229,innFactory,https://innFactory.de,de,innfactori softwar app develop cloud,10_cloudplan_cloud_kubernet_servic
2230,Hydrogentle,http://www.hydrogentle.de/,de,hydrogentl gentl energi solut menu button gentl energi solut hydrogen hydrogentl gmbh member hamburg renew energi network novemb alreadi look back mani success project relat green hydrogen thing c...,-1_industri_develop_employe_design
2231,PimaAssist,https://pimaassist.de/,de,pimaassist increas effici nurs staff ensur effici care us patient communic ad valu time save use pimaassist abl measur effici gain per nurs shift faster reaction time faster respons time nurs use ...,0_medic_medicin_health_healthcar
2232,Topi,http://topi.eu/,en,topi home switchtosimpl local local back main menuhardwar made simpl topi provid under technolog b b subscript economi platform enabl retail manufactur offer hardwar product month subscript bye by...,5_marketplac_retail_salesforc_market
2233,CareNext,https://carenext.net/,de,patient transfer carenext platform effici patient transfer platform effici patient transfer carenext platform shorten work step involv patient transfer suitabl follow caregiv leav time person adva...,0_medic_medicin_health_healthcar
2234,cloudficient Solutions,https://www.cloudficient.com,en,cloud migrat servic data migrat cloudfici search cloud migrat servic cloudfici help organ secur effici leverag power cloud evolv flexibl autom way cloud migrat servic offer complet onboard offboar...,10_cloudplan_cloud_kubernet_servic
2235,DigitalSchoolStory,https://digitalschoolstory.de/,de,digitalschoolstori menu everyon schoolyard talk tiktok switch class digitalschoolstori inspir young peopl learn turn pure social media consum activ design internet classroom societi method media c...,11_tutor_classroom_learner_student
2236,AddTec - Additive Technologies,https://www.addtec.eu/,de,addtecaddit technolog gmbhturningmil print plastic print metal scan servicereconstruct componentscom soon,-1_industri_develop_employe_design
2237,JoinMyTrip,https://www.joinmytrip.de,de,travel cool destin joinmytrip enenglishdeutsch eur regist whatsapptravel small group touristglobetrotterexploreradventurerfriendsglobetrott incred authent absolut uniqu simpli unforgett searchfind...,6_hotel_holiday_rental_rent
2238,McMakler,https://mcmakler.de/,de,immobilienmakl mcmakler sale purchas valuat financ need valu properti foryour real estat agent free valuat want selli want buyim curiousgood reason mcmaklerw new prospect buyer everi monthw german...,-1_industri_develop_employe_design
2239,Luxshield,https://luxshield.de,de,tailor made bumper protect paint protect film luxshield free ship order valu day right return follow us luxshield regist vehicl drive car motorbik bicycl choos anoth brand choos model choos year m...,-1_industri_develop_employe_design
2240,Motius,http://motius.de,en,motius reinvent randd creat tech product futur reinvent randd believ rate technolog chang increas therefor creat uniqu fluid structur allow us focus newest technolog occur tech cycl bring best tec...,-1_industri_develop_employe_design
2241,easyraw,https://www.easyraw.de/,de,p x dri fruit buy dri fruit paexfood de close menu shop cart close shop cart subtot discount code ship cost tax calcul checkout checkout shop cart current empti paexfood de seitennavig search clos...,15_vegan_supplement_meat_dietari
2242,Movizon,https://www.movizon.de/,de,optim logist autom dynam process transpar effici logist thank intellig design agv base autom innov think ahead horizon even beyond develop softwar plan work project custom realli appreci conquer n...,-1_industri_develop_employe_design
2243,Ingpuls,http://www.ingpuls.de,de,ingpul bochum expert shape memori alloy companyintellig materi chang futur product thus futur peopl industri solutionsour shape memori alloy alreadi found million premium vehicl well satellit hous...,-1_industri_develop_employe_design
